{
  "$schema": "https://doowon.local/docs/harness/schemas/scenario-manifest.schema.json",
  "scenario_id": "plm-query",
  "goal": "읽기 전용 PLM 질의를 안전하게 계획하고 실행하며, 표와 짧은 해석을 반환한다.",
  "domain_ids": ["plm"],
  "keywords": ["plm", "sql", "bom", "query", "validator", "품목", "도면"],
  "source_doc": "docs/harness/scenarios/plm-query.md",
  "workflow_bundle": "docs/harness/prompt-bundles/plm-query/workflow.json",
  "eval_suite": "docs/harness/manifests/eval-suites/plm-query.json",
  "trace_grade_spec": "docs/harness/manifests/trace-grade-specs/plm-query.json",
  "release_gate": "docs/ops/release-gates-and-alerts.md",
  "must_read_docs": [
    "agents.md",
    "docs/agents/context-loading-policy.md",
    "docs/agents/agent-operating-standard.md",
    "docs/harness/scenarios/plm-query.md",
    "docs/harness/manifests/scenarios/plm-query.json",
    "docs/harness/prompt-bundles/plm-query/workflow.json"
  ],
  "optional_support_docs": [
    "docs/harness/eval-regression-spec.md",
    "docs/harness/service-runtime-harness.md",
    "docs/harness/trace-and-scorecard-spec.md",
    "docs/ops/release-gates-and-alerts.md"
  ],
  "do_not_load_by_default": [
    "docs/harness/scenarios/documents-rag.md",
    "docs/harness/scenarios/draft-generation.md",
    "docs/harness/scenarios/ocr-pipeline.md",
    "docs/harness/scenarios/wiki-pms.md"
  ],
  "allowed_tools": [
    "Intent router",
    "Template matcher",
    "SQL planner",
    "SQL validator",
    "Read-only executor",
    "Result summarizer"
  ],
  "guardrail_policies": [
    "unsafe_sql_block",
    "acl_enforced",
    "allowlist_required"
  ],
  "expected_artifacts": [
    "ScenarioManifest update",
    "SQL safety or policy review",
    "EvalSuite refresh",
    "Promptfoo adversarial coverage review"
  ]
}
